{
  "schema_version": "bb-graphics-pipeline-producer/v1",
  "source": {
    "repository": "https://github.com/shadps4-emu/shadPS4",
    "commit": "e3ce810f3a653f43ac64ebab63023de281a4103a"
  },
  "seam": {
    "path": "src/video_core/renderer_vulkan/vk_pipeline_cache.cpp",
    "symbol": "VideoCore::PipelineCache::GetGraphicsPipeline",
    "observation_point": "post_lookup_result"
  },
  "identity_contract": {
    "model_version": "bb-graphics-identity/v2",
    "key_surface_version": "bb-graphics-pipeline-key-surface/v12"
  },
  "producer": {
    "producer_id": "shadps4-bb-pipeline-observer",
    "producer_sha256": "1111111111111111111111111111111111111111111111111111111111111111"
  },
  "observations": [
    {
      "seq": 0,
      "pipeline_identity": "pipeline:sha256:aaaaaaaaaaaaaaaaaaaaaaaaaaaaaaaaaaaaaaaaaaaaaaaaaaaaaaaaaaaaaaaa",
      "result": "created"
    },
    {
      "seq": 1,
      "pipeline_identity": "pipeline:sha256:aaaaaaaaaaaaaaaaaaaaaaaaaaaaaaaaaaaaaaaaaaaaaaaaaaaaaaaaaaaaaaaa",
      "result": "cache_hit"
    },
    {
      "seq": 2,
      "pipeline_identity": "pipeline:sha256:bbbbbbbbbbbbbbbbbbbbbbbbbbbbbbbbbbbbbbbbbbbbbbbbbbbbbbbbbbbbbbbb",
      "result": "created"
    }
  ]
}
